
<?xml version="1.0"?>
<invoice xmlns="http://www.dit.ie" xmlns:xsi="http://www.w3.org/2001/XMLScheme-instance" xsi:schemaLocation="http://www.dit.ie invoice.xsd">
	<invoiceNumber>12345</invoiceNumber>
	<invoiceDate>01/01/2018</invoiceDate>
	<invoiceTotal>39.99</invoiceTotal>
	<issuedBy>John Doe</issuedBy>
	<billTo>
		<name>Jane Doe</name>
		<address>123 Fake Street</address>
		<city>Dublin</city>
		<country>Ireland</country>
	</billTo>
	<item>
		<itemName>Shirt</itemName>
		<id>12</id>
		<price>39.99</price>
		<quantity>1</quantity>
	</item>
	<paymentInformation>
		<name>Jane Doe</name>
		<IBAN>IE123456789</IBAN>
		<BIC>IE123</BIC>
	</paymentInformation>
</invoice>